{"schema_version":1,"source_kind":"nvapi_voltage_status","gpu_index":0,"gpu_uuid":"GPU-11111111-2222-3333-4444-555555555555","captured_at_utc":"2026-09-05T20:42:55.0690000\u002B00:00","captured_at_unix_ms":1788640975069,"monotonic_ns":36656838355800,"monotonic_frequency_hz":10000000,"gpu_core_voltage_microvolts":956250,"gpu_core_voltage_v":0.95625,"native_status":0,"profile_evidence_stage":"matched_external_reference","profile_name":"rtx3060-2504-1536-vbios-94.06.25.00.fc-driver-610.88","interface_id":"0x465f9bcf","structure_version":"0x0001004c","nvapi_module_sha256":"df6455ccf83e43cfe68f405af1eec4e053c7f95da998bf358053b7583980c2f4","function_rva":"0x001c9070"}
